,channel,title,video_id,video_description,published_date,extraction_date,likes,dislikes,views,comment,thumbnail
523,Insper,31º Colação de Grau - Homenagem aos Pais | Insper,zlAekThi6TQ,"Homenagem aos pais dos alunos de Administração e Ciências Econômicas, da 31º Colação de Grau Insper",2018-04-11T15:28:47Z,2021-10-05 20:16:11.146883,10,0,1009,0,https://i.ytimg.com/vi/zlAekThi6TQ/hqdefault.jpg
524,Insper,31º Colação de Grau - Orador da turma de Ciências Econômicas,8h4Iu4GdzJE,Orador da turma de Ciências Econômicas Insper - 31º Colação de Grau,2018-04-11T15:20:06Z,2021-10-05 20:16:11.146883,21,0,874,0,https://i.ytimg.com/vi/8h4Iu4GdzJE/hqdefault.jpg
525,Insper,31º Colação de Grau - Discurso do Presidente | Insper,bn0aRLlSa84,Discurso do Presidente Marcos Lisboa na 31º Formatura dos cursos de Administração e Ciências Econômicas do Insper.,2018-04-11T15:14:57Z,2021-10-05 20:16:11.146883,24,0,610,1,https://i.ytimg.com/vi/bn0aRLlSa84/hqdefault.jpg
526,Insper,Obras novo campus Insper | Jan/2018,smS8X03BT0E,"Em 2019 teremos um novo campus. Acesse ao vídeo e veja como está o andamento da obra.

Janeiro/2018",2018-04-10T19:58:45Z,2021-10-05 20:16:11.146883,7,0,288,0,https://i.ytimg.com/vi/smS8X03BT0E/hqdefault.jpg
527,Insper,Curso de Investimento em PPP,lo0YWApygU4,"Venha conhecer mais sobre as práticas de parcerias público-privadas, com profissionais do mercado e com professores pesquisadores. 
Conheça mais no site: https://www.insper.edu.br/educacao-executiva/cursos-de-curta-duracao/politicas-publicas/investimentos-em-parcerias-publico-privadas/",2018-03-09T18:29:31Z,2021-10-05 20:16:11.146883,8,0,686,0,https://i.ytimg.com/vi/lo0YWApygU4/hqdefault.jpg
528,Insper,Depoimento Ronaldo Cabral e Camilla Lindstaedt,ygtyDNdChB0,"A aluna Camilla (ADM 2016) e o aluno Ronaldo (ECO 2016) promoveram o GAS Challenge, que é uma competição nacional de empreendedorismo social universitário. O desafio, cujo objetivo consistia em identificar e impulsionar projetos de cunho social foi realizado em três etapas. O evento durou uma semana contando com uma agenda cheia de workshops e palestras para os candidatos.",2018-02-27T17:04:11Z,2021-10-05 20:16:11.146883,11,0,295,0,https://i.ytimg.com/vi/ygtyDNdChB0/hqdefault.jpg
529,Insper,Cátedra Instituto Palavra Aberta | Insper,GesdrpBbrGM,A Cátedra Insper e Palavra Aberta tem como missão defender o valor da liberdade de expressão. Conheça!,2018-02-26T17:56:48Z,2021-10-05 20:16:11.146883,9,0,295,0,https://i.ytimg.com/vi/GesdrpBbrGM/hqdefault.jpg
530,Insper,"Urbanismo, Cidades e Liderança Consciente - Parte 2 - Prof. Danilo | Insper",hH9OoMXuJW4,"Venha conhecer um pouco mais sobre economia e cidades com o professor, DaniIo Igliore, nosso professor no curso Urbanismo, Cidades e Liderança Consciente.",2018-02-20T19:03:18Z,2021-10-05 20:16:11.146883,1,0,37,2,https://i.ytimg.com/vi/hH9OoMXuJW4/hqdefault.jpg
531,Insper,"Urbanismo, Cidades e Liderança Consciente - Parte 1 - Prof. Danilo | Insper",fGjPL4_uP2Y,"Venha conhecer um pouco mais sobre economia e cidades com o professor, DaniIo Igliore, nosso professor no curso Urbanismo, Cidades e Liderança Consciente.",2018-02-20T19:02:07Z,2021-10-05 20:16:11.146883,2,0,36,0,https://i.ytimg.com/vi/fGjPL4_uP2Y/hqdefault.jpg
532,Insper,"Urbanismo, Cidades e Liderança Consciente - Profª Beatriz | Insper",_67pVzRasQg,"O que é a cidade que nós vivemos? A professora Beatriz fala um pouco deste módulo no curso Urbanismo, Cidades e Liderança Consciente.",2018-02-20T19:00:40Z,2021-10-05 20:16:11.146883,4,0,107,0,https://i.ytimg.com/vi/_67pVzRasQg/hqdefault.jpg
533,Insper,Cátedra Instituto Escolhas | Insper,oGT9FsHY6SU,"A Cátedra Economia e Meio Ambiente estuda as relações entre a economia e o meio ambiente, promovendo iniciativas voltadas às questões socioambientais.",2018-02-19T21:09:17Z,2021-10-05 20:16:11.146883,7,0,246,0,https://i.ytimg.com/vi/oGT9FsHY6SU/hqdefault.jpg
534,Insper,Obras novo Campus | Insper,y9xi01U45fE,Obras do novo campus Insper realizadas em Dezembro de 2017,2018-02-16T19:44:28Z,2021-10-05 20:16:11.146883,27,0,903,5,https://i.ytimg.com/vi/y9xi01U45fE/hqdefault.jpg
535,Insper,Cátedra Instituto Ayrton Senna | Insper,94pYwfjAcRY,A Cátedra Instituto Ayrton Senna gera pesquisas para o desenvolvimento de políticas públicas na educação. Conheça!,2018-02-08T16:42:42Z,2021-10-05 20:16:11.146883,8,0,444,0,https://i.ytimg.com/vi/94pYwfjAcRY/hqdefault.jpg
536,Insper,Cátedra Chafi Haddad | Insper,MEwm7B20CQw,"A Cátedra Chafi Haddad tem como missão promover pesquisas e debates voltados à área de Administração. Ela é liderada pelo professor Sérgio Lazzarini que, neste vídeo, fala sobre os desafios e oportunidades. Conheça!",2018-02-02T17:59:21Z,2021-10-05 20:16:11.146883,5,0,337,0,https://i.ytimg.com/vi/MEwm7B20CQw/hqdefault.jpg
537,Insper,Cátedra Endeavor | Insper,DXVPs6INXfs,"A Cátedra Endeavor foi criada para produzir conhecimento relevante em empreendedorismo e propostas de melhorias das políticas públicas para empresas Scale-Ups no país.

Saiba mais sobre as Cátedras do Insper: goo.gl/iLjw9x",2018-01-24T21:07:18Z,2021-10-05 20:16:11.146883,5,0,253,0,https://i.ytimg.com/vi/DXVPs6INXfs/hqdefault.jpg
538,Insper,Cátedra Instituto Unibanco | Insper,auOkA69y0wI,"O Insper e o Instituto Unibanco se uniram para criar uma cátedra dedicada à pesquisa sobre o Ensino Médio no Brasil.

Saiba mais sobre as Cátedras do Insper: goo.gl/iLjw9x",2018-01-22T21:09:05Z,2021-10-05 20:16:11.146883,12,0,503,0,https://i.ytimg.com/vi/auOkA69y0wI/hqdefault.jpg
539,Insper,Cátedra IFB | Insper,a0r5bS08Ni4,"A Cátedra IFB contribui para o debate de políticas públicas com pesquisas sobre educação, criminalidade, mercado de trabalho e muitos outros temas. Assista ao vídeo e conheça!

Saiba mais sobre as Cátedras do Insper: goo.gl/iLjw9x",2018-01-15T14:49:10Z,2021-10-05 20:16:11.146883,6,0,245,0,https://i.ytimg.com/vi/a0r5bS08Ni4/hqdefault.jpg
540,Insper,Gestão Estratégica de Projetos | Insper,9ZhxjRrlI-4,Conheça o curso de curta duração do Insper de Gestão Estratégica de Projetos. Confira as próximas turmas: https://goo.gl/pW4DhT,2017-12-18T19:30:24Z,2021-10-05 20:16:11.146883,5,0,4303,0,https://i.ytimg.com/vi/9ZhxjRrlI-4/hqdefault.jpg
541,Insper,Depoimento Marcelo Augusto de Oliveira - APF - 27/09/2017 | Insper,Lm4ZfjpTWHs,"Depoimento do aluno Marcelo Augusto, da turma de Advanced Program in Finance.",2017-12-14T17:41:10Z,2021-10-05 20:16:11.146883,1,0,226,1,https://i.ytimg.com/vi/Lm4ZfjpTWHs/hqdefault.jpg
542,Insper,Depoimento Felipe Silva Bras - CMM - 27/09/2017 | Insper,41aFtnObVuc,"Depoimento do aluno Felipe Silva Bras, da turma de Certificate in Marketing Management.",2017-12-14T17:39:27Z,2021-10-05 20:16:11.146883,1,0,74,0,https://i.ytimg.com/vi/41aFtnObVuc/hqdefault.jpg
543,Insper,Depoimento Bárbara Palmieri - CFM - 27/09/2017 | Insper,ZGzCoyvCxZg,"Depoimento da aluno Bárbara Palmieri, da turma de Certificate in Financial Management.",2017-12-14T17:36:38Z,2021-10-05 20:16:11.146883,5,0,378,0,https://i.ytimg.com/vi/ZGzCoyvCxZg/hqdefault.jpg
544,Insper,Depoimento Anna Helena Vidigal - APF - 27/09/2017 | Insper,IuZCbJyAv0o,"Depoimento da aluna Anna Helena, da turma de Advanced Program in Finance.",2017-12-14T17:22:16Z,2021-10-05 20:16:11.146883,1,0,208,0,https://i.ytimg.com/vi/IuZCbJyAv0o/hqdefault.jpg
545,Insper,Depoimento Tiago Miranda - MBA - 26/09/2017 | Insper,v9vq-0JfBqc,"Depoimento do aluno Tiago Miranda, da turma de MBA Executivo em Finanças.",2017-12-14T17:19:02Z,2021-10-05 20:16:11.146883,2,0,163,0,https://i.ytimg.com/vi/v9vq-0JfBqc/hqdefault.jpg
546,Insper,Depoimento Victor Haim - CBA - 26/09/2017 | Insper,wvb88hGG9ks,"Depoimento do aluno Victor Haim, da turma de Certificate in Business Administration.",2017-12-14T17:15:23Z,2021-10-05 20:16:11.146883,4,0,135,0,https://i.ytimg.com/vi/wvb88hGG9ks/hqdefault.jpg
547,Insper,Depoimento Breno Bertolani Carli - CBPM - 26/09/2017 | Insper,WwpS86R_hFI,"Depoimento do aluno Breno Bertolani, da turma de Certificate in Business and People Management.",2017-12-14T17:10:31Z,2021-10-05 20:16:11.146883,0,0,88,0,https://i.ytimg.com/vi/WwpS86R_hFI/hqdefault.jpg
548,Insper,Depoimento Pedro Cypriano - MBA - 25 09 2017 | Insper,iWDSYnRBi-s,"Depoimento do aluno Pedro Cypriano, da turma de MBA Executivo.",2017-12-14T17:02:31Z,2021-10-05 20:16:11.146883,3,0,243,0,https://i.ytimg.com/vi/iWDSYnRBi-s/hqdefault.jpg
549,Insper,Depoimento Tiago Miranda - MBA - 25 09 2017 | Insper,-vCSIu-ui84,"Depoimento do aluno Tiago Miranda, da turma de MBA Executivo Finanças.",2017-12-14T16:58:30Z,2021-10-05 20:16:11.146883,0,0,65,0,https://i.ytimg.com/vi/-vCSIu-ui84/hqdefault.jpg
550,Insper,Depoimento Julio Cesar Bertacini - MBA - 25/09/2017 | Insper,JfUHtWNE0iU,"Depoimento do aluno Julio Cesar Bertacini, da turma de MBA Executivo em Gestão de Saúde Einstein-Insper.",2017-12-14T16:50:41Z,2021-10-05 20:16:11.146883,0,0,74,0,https://i.ytimg.com/vi/JfUHtWNE0iU/hqdefault.jpg
551,Insper,Depoimento Marco Aurélio Vitorino - MBA - 25/09/2017 | Insper,axz6jdF_kQo,"Depoimento do aluno Marco Aurélio Vitorno, da turma de MBA em Gestão de Saúde Einstein-Insper.",2017-12-14T16:43:20Z,2021-10-05 20:16:11.146883,1,0,67,0,https://i.ytimg.com/vi/axz6jdF_kQo/hqdefault.jpg
552,Insper,"Formatura das turmas de MBA - MBA Executivo, MBF e MBS - 25/09/2017 | Insper",cdUGLpMItdE,"Formatura das turmas de MBA - MBA Executivo, MBF e MBS, realizada no dia 25/09/2017.",2017-12-14T16:40:32Z,2021-10-05 20:16:11.146883,6,0,248,0,https://i.ytimg.com/vi/cdUGLpMItdE/hqdefault.jpg
553,Insper,Formatura das turmas de MBA - CBA CBP e CBPM - 26/09/2017 | Insper,OuMeEnLawOw,"Formatura das turmas de MBA - CBA CBP e CBPM, realizada no dia 26/09/2017",2017-12-14T16:37:57Z,2021-10-05 20:16:11.146883,1,0,104,0,https://i.ytimg.com/vi/OuMeEnLawOw/hqdefault.jpg
554,Insper,"Formatura MBA’s - CMM, CFM , CHM e APF - 27/09 | Insper",mQ9DMvc_ls0,"Formatura das turmas de MBA's - CMM, CFM, CHM e APF, realizada no dia 27/09/2017.",2017-12-14T16:29:33Z,2021-10-05 20:16:11.146883,1,0,150,0,https://i.ytimg.com/vi/mQ9DMvc_ls0/hqdefault.jpg
555,Insper,Formatura CBA - Depoimento do aluno Fabio Leite | Insper,44d7Itilsts,"Depoimento do aluno Fabio Leite, da turma de Certificates in Business Administration realizada no dia 11/04/2017.",2017-12-08T14:08:49Z,2021-10-05 20:16:11.146883,2,0,66,0,https://i.ytimg.com/vi/44d7Itilsts/hqdefault.jpg
556,Insper,"Formatura CBA, CBP e CBPM - 11/04/2017 | Insper",A4rgfiMPsv4,"Formatura das turmas de Certificates, dos cursos Business Administration, Business Projects e Business and People Management, realizada no dia 11/04/2017",2017-12-08T13:58:27Z,2021-10-05 20:16:11.146883,1,0,96,0,https://i.ytimg.com/vi/A4rgfiMPsv4/hqdefault.jpg
557,Insper,Depoimento Marcos Roberto Cunha - MBA em Saúde | Insper,px7cqi-R7Qc,"Depoimento do aluno Marcos Roberto, da turma de MBA em Saúde Einstein.
Formatura MBA - 10/04/2017",2017-12-07T18:48:54Z,2021-10-05 20:16:11.146883,1,0,70,0,https://i.ytimg.com/vi/px7cqi-R7Qc/hqdefault.jpg
558,Insper,Depoimento Luis Fernando Saife - MBA Finanças | Insper,fJb_E_MOv4A,"Depoimento do aluno Luis Fernando Saife, da turma de MBA em Finanças.
Formatura MBA - 10/04/2017",2017-12-07T18:47:38Z,2021-10-05 20:16:11.146883,1,0,102,0,https://i.ytimg.com/vi/fJb_E_MOv4A/hqdefault.jpg
559,Insper,Depoimento Ivana Lemos - MBA Executivo | Insper,w_QnSuDMBi4,"Depoimento da aluna Ivana Lemos, da turma de MBA Executivo.
Formatura MBA - 10/04/2017",2017-12-07T18:46:01Z,2021-10-05 20:16:11.146883,2,0,120,0,https://i.ytimg.com/vi/w_QnSuDMBi4/hqdefault.jpg
560,Insper,Formatura MBA | 10/04/2017 | Insper,ohxtptK9k8U,"Formatura das turmas de MBA, realizada no dia 10/04/2017",2017-12-07T18:43:51Z,2021-10-05 20:16:11.146883,1,0,131,0,https://i.ytimg.com/vi/ohxtptK9k8U/hqdefault.jpg
561,Insper,Insper | Aluna bolsista como foi representar o Insper no CFA Research Challenge,uL7JsjTBfcM,"A aluna Ana Paulo Porto e outros quatro alunos representaram o Insper no CFA Research Challenge, competição global que reúne universidades para fazer uma tese de investimento de uma empresa listada na Bolsa de Valores. A equipe conquistou o 1° lugar na etapa brasileira e foram o primeiro time a ir para a final regional das Américas, ficando em 3° lugar.",2017-12-06T17:54:47Z,2021-10-05 20:16:11.146883,38,0,848,1,https://i.ytimg.com/vi/uL7JsjTBfcM/hqdefault.jpg
562,Insper,Novo Campus Insper - Obra em Novembro/2017,-ghXLsIdkaE,Acompanhe o andamento da construção do novo campus do Insper.,2017-12-05T19:05:06Z,2021-10-05 20:16:11.146883,9,0,714,0,https://i.ytimg.com/vi/-ghXLsIdkaE/hqdefault.jpg
563,Insper,Claudio Haddad recebe homenagem por legado para a educação,IrZsIhnKNo0,"O fundador e presidente do Conselho Deliberativo do Insper, Claudio Haddad, foi homenageado pela BrazilFoundation pelo seu legado para a educação. Confira o vídeo produzido para homenageá-lo no evento, realizado no dia 29/11/2017.",2017-11-30T16:39:31Z,2021-10-05 20:16:11.146883,45,1,912,0,https://i.ytimg.com/vi/IrZsIhnKNo0/hqdefault.jpg
564,Insper,"Urbanismo, Cidades e Liderança Consciente - prof. Tomas Alvim | Insper",J5Jze0VFqzM,"Como você - cidadão, empresa ou governo - pode agir para que as cidades superem seus desafios e realizem seu potencial de crescimento e pluralidade?

Saiba o que Tomas Alvim, cofundador do Arq.Futuro e professor curso Urbanismo, Cidades e Liderança consciente fala sobre a parceria com o Insper para criação do curso.

Confira mais informações sobre o curso: https://goo.gl/ksGnFQ",2017-11-10T16:19:31Z,2021-10-05 20:16:11.146883,5,0,1579,0,https://i.ytimg.com/vi/J5Jze0VFqzM/hqdefault.jpg
565,Insper,"Urbanismo, Cidades e Liderança Consciente - prof. Vinicius Andrade | Insper",0a22-z3zqDw,"Como você - cidadão, empresa ou governo - pode agir para que as cidades superem seus desafios e realizem seu potencial de crescimento e pluralidade?

Saiba o que o professor Vinícius Andrade do curso Urbanismo, Cidades e Liderança consciente acredita sobre o processo de urbanização no Brasil e como podemos construir as cidades.

Confira mais informações sobre o curso goo.gl/jg2Xyx",2017-11-10T16:23:10Z,2021-10-05 20:16:11.146883,6,0,77,0,https://i.ytimg.com/vi/0a22-z3zqDw/hqdefault.jpg
566,Insper,"Urbanismo, Cidades e Liderança Consciente - prof. Sérgio Lazzarini | Insper",Ur2HQAi3zMU,"Como você - cidadão, empresa ou governo - pode agir para que as cidades superem seus desafios e realizem seu potencial de crescimento e pluralidade?

Saiba o que o professor Sérgio Lazzarini do curso Urbanismo, Cidades e Liderança consciente, falou sobre Mensuração de Impacto Social.

Confira mais informações sobre o curso: http://goo.gl/CHcK1v",2017-11-10T16:17:02Z,2021-10-05 20:16:11.146883,10,0,209,0,https://i.ytimg.com/vi/Ur2HQAi3zMU/hqdefault.jpg
567,Insper,Insper | Conheça nossas Cátedras,tJ78CVqLxOg,Conheça a contribuição de cada cátedra do Insper para a sociedade.,2017-11-06T16:52:46Z,2021-10-05 20:16:11.146883,38,2,1429,0,https://i.ytimg.com/vi/tJ78CVqLxOg/hqdefault.jpg
568,Insper,Insper | Alunos bolsistas contemplados com dupla titulação,cTVZInbm7Zw,"Os alunos bolsistas integrais Jaqueline Assunção e Jefferson Viana, do 6º semestre de Economia, foram aprovados numa oportunidade de dupla titulação em Portugal! Em um ano e meio eles estarão com o diploma da graduação do Insper e do mestrado em mãos, que será concluído na Universidade NOVA de Lisboa. Hoje esta universidade é reconhecida como a 5º melhor faculdade de Economia da Europa.",2017-11-01T16:07:25Z,2021-10-05 20:16:11.146883,32,0,1070,1,https://i.ytimg.com/vi/cTVZInbm7Zw/hqdefault.jpg
569,Insper,Novo Campus Insper - Obra em Outubro/2017,ixZUsQFOEEw,Acompanhe o andamento da construção do novo campus do Insper.,2017-10-31T20:19:18Z,2021-10-05 20:16:11.146883,17,1,836,0,https://i.ytimg.com/vi/ixZUsQFOEEw/hqdefault.jpg
570,Insper,Conheça o Teamwork Experience,PzHrPvXGFB8,"Habilidades para trabalho em equipe são fundamentais para todos nós, independentemente da área de atuação ou etapa da vida. Pensando nisso, desenvolvemos o Teamwork Experience, abordagem integrada ao programa CBPM, que desenvolve essas capacidades por meio de coaching em grupo.

Confira a opinião das alunas Dora Werneck, Thaís Zaharansky, Letícia Fernandes e Vanusa Santos sobre essa experiência transformadora.

Conheça o programa: https://goo.gl/oW5psw",2017-10-30T17:34:31Z,2021-10-05 20:16:11.146883,6,0,350,0,https://i.ytimg.com/vi/PzHrPvXGFB8/hqdefault.jpg
571,Insper,Teamwork Experience – Aluna Thaís Zaharansky,iC9IW6fcVdQ,"A aluna do CBPM, Thaís Zaharansky, conta como superou os desafios de liderar equipes por meio do Teamwork Experience. Ela teve a oportunidade de rever seus comportamentos e aprimorá-los para ter melhores resultados.

Confira o vídeo completo sobre o programa: https://youtu.be/PzHrPvXGFB8",2017-10-30T17:34:25Z,2021-10-05 20:16:11.146883,5,0,285,0,https://i.ytimg.com/vi/iC9IW6fcVdQ/hqdefault.jpg
572,Insper,Teamwork Experience – Aluna Dora Werneck,r8wcjl0YpoQ,"Confira a opinião da nossa aluna Dora Werneck sobre o Teamwork Experience! Ela desenvolveu habilidades para explorar seus pontos fortes e aprimorar a forma de trabalhar em equipe, motivando o time e incentivando a participação nas sessões de coaching.

Confira o vídeo completo sobre o programa: https://youtu.be/PzHrPvXGFB8",2017-10-30T17:34:20Z,2021-10-05 20:16:11.146883,3,0,146,0,https://i.ytimg.com/vi/r8wcjl0YpoQ/hqdefault.jpg
573,Insper,MBA Insper: Carla Ramos – Marca que amamos,PKMqYXFf4oM,"Carla Ramos é professora de Marketing dos nossos cursos de pós-graduação e no vídeo acima ela nos conta um pouco sobre a trajetória de uma marca que a inspira tanto quanto dar aulas: as Havaianas. Para Carla, é um grande estudo de caso, pois passou de um produto popular à um objeto de desejo entre todas as classes sociais, sendo conhecida no mundo inteiro. A marca cresceu e ganhou força através do reposicionamento adotado no final da década de 90, além de ter conseguido manter presente sua proposta de valor em todos os pontos de contato. Viva a experiência Insper e transforme o seu futuro! Conheça nossos Cursos de Pós-Graduação.",2017-10-20T17:46:01Z,2021-10-05 20:16:11.146883,13,1,546,0,https://i.ytimg.com/vi/PKMqYXFf4oM/hqdefault.jpg
574,Insper,Insper | Depoimento Renan Almeida - aluno bolsista,l1Glfs6gpU0,"Durante o estágio na corretora Rico, o aluno bolsista Renan Almeida (ADM 5º semestre) desenvolveu um projeto, cujo obtivo era conectar o aluno universitário com o mercado financeiro. Para isso ele ajudou a estruturar um campeonato universitário de swing traders, envolvendo os alunos de Economia, Administração e Engenharia do Insper.",2017-10-02T17:24:02Z,2021-10-05 20:16:11.146883,23,1,698,2,https://i.ytimg.com/vi/l1Glfs6gpU0/hqdefault.jpg
575,Insper,Novo Campus Insper - Obra em Agosto/2017,y3h1fWiqg3Y,"Acompanhe evolução da construção do novo campus do Insper, no mês de agosto de 2017.",2017-09-26T14:43:12Z,2021-10-05 20:16:11.146883,19,0,1075,4,https://i.ytimg.com/vi/y3h1fWiqg3Y/hqdefault.jpg
576,Insper,Residencial Toca da Raposa | Insper,cUraPCuclL0,Veja como ficou a casa e como foi a chegada dos novos moradores.,2017-09-01T19:58:48Z,2021-10-05 20:16:11.146883,264,4,7230,12,https://i.ytimg.com/vi/cUraPCuclL0/hqdefault.jpg
577,Insper,Novo Campus Insper - Obra em Julho/2017,qW94czHJ5-8,Acompanhe o andamento da construção do novo campus do Insper.,2017-08-17T21:45:27Z,2021-10-05 20:16:11.146883,36,0,1821,0,https://i.ytimg.com/vi/qW94czHJ5-8/hqdefault.jpg
578,Insper,Professor Luiz Vieira fala sobre Portfólio de Projetos,QCHnF8DZ-Sk,"O Professor Luiz Vieira se dedica à comunidade Insper há mais de 15 anos e, é responsável pelo curso de curta duração em Gestão Estratégica de Projetos. Confira as próximas turmas: https://goo.gl/pW4DhT

Como a realização de projetos está relacionada com o crescimento na carreira?

Conheça: https://goo.gl/eN7nF3 

#SomosInsper",2017-06-30T18:19:58Z,2021-10-05 20:16:11.146883,4,1,465,0,https://i.ytimg.com/vi/QCHnF8DZ-Sk/hqdefault.jpg
579,Insper,Veja um case abordado no curso de Gestão Estratégica de Projetos,AhaG-gyNlEI,"O Professor Luiz Vieira se dedica à comunidade Insper há mais de 15 anos e, é responsável pelo curso de curta duração em Gestão Estratégica de Projetos. Confira as próximas turmas: https://goo.gl/pW4DhT

O case trabalhado no curso permite a compreensão de como uma empresa pode criar uma estratégia e desenvolvê-la em projetos.

Conheça: https://goo.gl/eN7nF3 

#SomosInsper",2017-06-30T18:17:32Z,2021-10-05 20:16:11.146883,7,1,1156,0,https://i.ytimg.com/vi/AhaG-gyNlEI/hqdefault.jpg
580,Insper,Convite para o curso de Gestão Estratégica de Projetos,Lt0udUrLiYY,"O Professor Luiz Vieira se dedica à comunidade Insper há mais de 15 anos e, é responsável pelo curso de curta duração em Gestão Estratégica de Projetos. Confira as próximas turmas: https://goo.gl/pW4DhT

Os projetos são instrumentos que possibilitam sair da estratégia para chegar nos objetivos desejados. 

Conheça: https://goo.gl/eN7nF3 

#SomosInsper",2017-06-30T17:36:37Z,2021-10-05 20:16:11.146883,5,1,690,0,https://i.ytimg.com/vi/Lt0udUrLiYY/hqdefault.jpg
581,Insper,Novo Campus Insper - Obra em Junho/2017,aOELlp7uxmE,Acompanhe o andamento da construção do novo campus do Insper.,2017-08-08T18:23:55Z,2021-10-05 20:16:11.146883,16,0,799,0,https://i.ytimg.com/vi/aOELlp7uxmE/hqdefault.jpg
582,Insper,Insper | Certificação EQUIS,mRzLTWhM8P0,"Com a certificação EQUIS, passamos a pertencer ao seleto grupo de menos de 1% das escolas de negócios do mundo que possuem a tríplice coroa (AACSB + EQUIS + AMBA).",2017-07-20T18:54:15Z,2021-10-05 20:16:11.146883,35,1,14268,0,https://i.ytimg.com/vi/mRzLTWhM8P0/hqdefault.jpg
583,Insper,Insper | Formatura Certificates - CBA - Depoimento Fábio Leite,QcprO-9LP30,"Formatura Certificates
Depoimento ao aluno Fábio Leite, do curso de CBA",2017-07-14T15:35:47Z,2021-10-05 20:16:11.146883,1,0,373,0,https://i.ytimg.com/vi/QcprO-9LP30/hqdefault.jpg
584,Insper,Insper | Formatura Certificates - CBA - Depoimento Rodolfo Batistela,k2PRZhDzJLI,"Formatura Certificates
Depoimento ao aluno Rodolfo Batistela, do curso de CBA",2017-07-14T15:32:36Z,2021-10-05 20:16:11.146883,0,0,97,0,https://i.ytimg.com/vi/k2PRZhDzJLI/hqdefault.jpg
585,Insper,Insper | Formatura Certificates - CBP - Depoimento Renan Costa,UC_tk_Eam8Q,"Formatura Certificates
Depoimento ao aluno Renan Costa, do curso de CBP",2017-07-14T15:31:07Z,2021-10-05 20:16:11.146883,1,0,94,0,https://i.ytimg.com/vi/UC_tk_Eam8Q/hqdefault.jpg
586,Insper,"Insper | Formatura Certificates - CBA, CBP e CBPM - 11.04.2017",0oeTEVEx1ek,"Formatura Certificates dos cursos CBA, CBP e CBPM",2017-07-14T15:24:14Z,2021-10-05 20:16:11.146883,4,0,306,0,https://i.ytimg.com/vi/0oeTEVEx1ek/hqdefault.jpg
587,Insper,Insper | Formatura Certificates - Depoimento Wellington Douglas,23jyQGOg-Cs,"Formatura Certificates - 12.04.2017
Depoimento do aluno Wellington Douglas, do curso de CFM",2017-07-14T14:53:05Z,2021-10-05 20:16:11.146883,7,0,226,0,https://i.ytimg.com/vi/23jyQGOg-Cs/hqdefault.jpg
588,Insper,Insper | Formatura Certificates - CMM - Depoimento Walkiria Guimarães,7F6JMbW_5L8,"Formatura Certificates - 12.04.2017
Depoimento da aluna Walkiria Guimarães, do curso de CMM",2017-07-14T14:32:52Z,2021-10-05 20:16:11.146883,2,0,80,0,https://i.ytimg.com/vi/7F6JMbW_5L8/hqdefault.jpg
589,Insper,Insper | Formatura Certificates - 12.04.2017,U-tmSmPtmjg,Formatura Certificates CMM e CFM,2017-07-14T14:26:04Z,2021-10-05 20:16:11.146883,3,0,446,0,https://i.ytimg.com/vi/U-tmSmPtmjg/hqdefault.jpg
590,Insper,Como executar uma estratégia bem-sucedida | Insper e Educação Executiva,VPYWkiS5d1Y,"A professora Letícia Costa fala sobre o nosso curso de Estratégia: Planejamento e Execução, que aborda maneiras de desenvolver e implementar estratégias vencedoras que maximizam o crescimento, o lucro e o êxito da sua empresa a longo prazo, provendo conhecimento e ferramentas necessárias para preencher a lacuna entre o desenvolvimento racional da estratégia e sua execução no dia-a-dia das organizações.

Saiba mais: http://goo.gl/1jteHJ

Estratégia e Negócios: http://www.insper.edu.br/educacao-executiva/estrategia-e-negocios/

Conheça a experiência Insper e transforme o seu futuro!

Programas de Ensino Insper

Graduação - http://www.insper.edu.br/graduacao/
Educação Executiva - http://www.insper.edu.br/educacao-executiva/
MBA - http://www.insper.edu.br/pos-graduacao/mba/
Mestrado - http://www.insper.edu.br/pos-graduacao/mestrado/",2017-06-29T21:16:04Z,2021-10-05 20:16:11.146883,14,0,1741,0,https://i.ytimg.com/vi/VPYWkiS5d1Y/hqdefault.jpg
591,Insper,Conheça o curso de Gestão Estratégica de Projetos | Insper,weck8sHHdEI,"O Professor Luiz Vieira se dedica à comunidade Insper há mais de 15 anos e, é responsável pelo curso de curta duração em Gestão Estratégica de Projetos. Confira as próximas turmas: https://goo.gl/pW4DhT


O curso de curta duração permitirá que você entenda planejamento estratégico e execução por meio de um PPM Portfolio Project Management, moderna metodologia de gestão focada em recursos e resultados, que promove a identificação e priorização de projetos a serem implementados.

Conheça: https://goo.gl/eN7nF3 

#SomosInsper",2017-06-30T17:33:22Z,2021-10-05 20:16:11.146883,9,1,1006,0,https://i.ytimg.com/vi/weck8sHHdEI/hqdefault.jpg
592,Insper,Insper - Formatura MBA’s - Ricardo Bussolan Juan,baPTLCvxyhE,,2017-06-08T20:07:05Z,2021-10-05 20:16:11.146883,1,0,110,0,https://i.ytimg.com/vi/baPTLCvxyhE/hqdefault.jpg
